Comment,Emotion,processed_comment,labeled_taget
my mother did not come home till late at night ages ago anyway if i dont know where my parents are and when theyll be back i start thinking that perhaps they have had an accident and are perhaps dead,fear,mother come home till late night age ago not know parent ll start think accident dead,1
i feel so overwhelmed im nauseous,fear,feel overwhelmed m nauseous,1
i feel like im selfish,anger,feel like m selfish,0
i feel like i m a very very dangerous human being right now,anger,feel like m dangerous human right,0
im taking advantage of feeling artistic incase it runs away again bell had her baby the other day yay,joy,m take advantage feel artistic incase run away bell baby day yay,2
i manage to reach a conclusion after all my musings i feel somehow more resolved,joy,manage reach conclusion musing feel resolved,2
i feel heartless now feeling bored and not believe in love anymore,anger,feel heartless feel bored believe love anymore,0
i feel bashful under his teasing scrutiny,fear,feel bashful teasing scrutiny,1
i doing something that make you feel bothered,anger,feel bothered,0
i don t want to cry either because i know she ll think i feel tortured having to eat the black part of the rice,anger,don t want cry know ll think feel torture have eat black rice,0
i feel greedy and selfish,anger,feel greedy selfish,0
i feel so invigorated so focused about what im being led to pursue right now and in the future,joy,feel invigorated focused m lead pursue right future,2
i feel shy when people reading these but i am writing it here so brothers and sisters would see how real life works,fear,feel shy people read write brother sister real life work,1
i feel so violent but im a paper tiger,anger,feel violent m paper tiger,0
i feel like i should try to calm her down shes been very good to me since the games ended but i can see katniss getting more and more tense with every schedule adjustment,joy,feel like try calm s good game end katniss get tense schedule adjustment,2
i feel especially vulnerable to being treated as a second class citizen,fear,feel especially vulnerable treat second class citizen,1
i could feel that the person was pissed at me because that person didnt understand what i was trying to say and so there was further personal attack again asking me whats my nationality giving me that shit face and blah blah,anger,feel person piss person not understand try personal attack ask s nationality give shit face blah blah,0
i remember two specific things from that class feeling terrified of my teacher who would repeat the same question in spanish with increasing volume until his victim either managed to answer correctly or ran away screaming and feeling distracted by the cute boy who helped me study for tests,fear,remember specific thing class feeling terrify teacher repeat question spanish increase volume victim manage answer correctly run away scream feel distract cute boy help study test,1
i love those ted talks i feel intimidated more than inspired because greater than great can be found in simplicity too,fear,love te talk feel intimidate inspire great great find simplicity,1
i know tv isnt everyones cup of tea so if that includes you feel free to scroll down a bit,joy,know tv not everyone cup tea include feel free scroll bit,2
i still feel a bit overwhelmed,fear,feel bit overwhelmed,1
ive been hanging around younger people and when i am with them i feel like im but when i see the photos of us together i am suddenly shaken to see just how old i look,fear,ve hang young people feel like m photo suddenly shake old look,1
im feeling so invigorated and ready for whats ahead and very excited to share all that information with all of you,joy,m feel invigorated ready s ahead excited share information,2
i feel so honored to know all of you,joy,feel honored know,2
i have a feeling i may be popular with the lady folk,joy,feeling popular lady folk,2
i feel that the out of people that i encounter in the day that are rude and mean to me for no reason at all,anger,feel people encounter day rude mean reason,0
i feel so tranquil right now its great,joy,feel tranquil right great,2
i put up my christmas tree and im feeling fairly festive,joy,christmas tree m feel fairly festive,2
i feel like i should have some wine or something i was amused,joy,feel like wine amuse,2
i feel quite nervous and scared too x scared cos ill be taking the plane back to singapore on my own cos i cant stay as long as my two other friends have planned t,fear,feel nervous scared x scared cos ill take plane singapore cos not stay long friend plan t,1
i feel like i shouldnt have even bothered,anger,feel like not bother,0
i think most people have little problem expressing but once in a while i can t help but feel that we shouldn t be afraid to let it all hang out there and express the other emotions that don t get nearly as much airtime,fear,think people little problem express t help feel shouldn t afraid let hang express emotion don t nearly airtime,1
i know what i believe and how i feel but some part of me is still hesitant because the old me would have said that anyone who believed there was a god was crazy,fear,know believe feel hesitant old say believe god crazy,1
i sometimes feel so vulnerable and so lost,fear,feel vulnerable lose,1
i feel uncertain if the most of similar families can be reached the uncertainty does not preclude us from serving those we can in the meantime while discovering the ways to reach the others,fear,feel uncertain similar family reach uncertainty preclude serve meantime discover way reach,1
i am saying that i am feeling helpless now that i have to walk on toes,fear,say feel helpless walk toe,1
i feel like someone s strange uncle trying to break the ice at a party by showing this amazing talent thinking that guests will be impressed but in turn just made everything a hundred times more awkward,fear,feel like s strange uncle try break ice party show amazing talent thinking guest impressed turn time awkward,1
i always had a feeling of being in shape and became increasingly frustrated with the daily accumulation of body fat elusive,anger,feeling shape increasingly frustrated daily accumulation body fat elusive,0
i do feel amused by all the different debates going on but on the other hand i felt that theres something missing,joy,feel amuse different debate go hand feel s miss,2
i feel like i can breath now and not be so rushed,anger,feel like breath rush,0
i lived her life without the feeling of acceptance she felt as though trouble and misery followed her everywhere she went and that everyone hated her because of it,anger,live life feeling acceptance feel trouble misery follow go hate,0
im still feeling a little shaky as i write this post,fear,m feel little shaky write post,1
ive been feeling restless in my career,fear,ve feel restless career,1
i give probably to the degree that some might see as too much but if i feel taken advantage of or wronged in any sense i have absolutely no problem shutting it down and walking away,anger,probably degree feel take advantage wrong sense absolutely problem shut walk away,0
im feeling irritated by her friggin name,anger,m feel irritated friggin,0
i was a child i stole rmb from my grandfather maternal and i feel i exceptionally wronged him,anger,child steal rmb grandfather maternal feel exceptionally wrong,0
im feeling queezy and cant be bothered putting these in order so here goes,anger,m feel queezy not bother put order go,0
i feel like a dangerous animal as i prowl out of the jungle and onto the warm sand of this deserted island,anger,feel like dangerous animal prowl jungle warm sand deserted island,0
i know it signifies him feeling not dangerous secure and relaxed so i don t guess it is causing him any undue stress,anger,know signify feel dangerous secure relaxed don t guess cause undue stress,0
i look back and i feel so incredibly satisfied with my life refreshed ready for my next adventure,joy,look feel incredibly satisfied life refresh ready adventure,2
i remember feeling so hellip furious with the shooter,anger,remember feel hellip furious shooter,0
i do not want to accept that it s inevitable that we all become grumpy old men and women as we age and i do not want to accept that feeling irritated and annoyed by trivial little things is normal,anger,want accept s inevitable grumpy old man woman age want accept feel irritated annoy trivial little thing normal,0
i feel i should probably move on to the meat of my story before i get too distracted by the side dishes what happened to good music,anger,feel probably meat story distract dish happen good music,0
i get nothing and i really want to feel like if someone likes me for who i am not for my stubborn sister,anger,want feel like like stubborn sister,0
i reached down to feel what that strange sensation was and i felt something there,fear,reach feel strange sensation feel,1
ill smoke a few cigarettes because im feeling a little nervous,fear,ill smoke cigarette m feel little nervous,1
i am feeling increasingly hopeful,joy,feel increasingly hopeful,2
i don t a feel like an idiot and b not get illogically mad at people for going to bed too early sorry for the anger family,anger,don t feel like idiot b illogically mad people go bed early sorry anger family,0
im feeling rather impatient with these rainbows bursting in my veins,anger,m feel impatient rainbow burst vein,0
id be more use at that level which would make the job feel more worthwhile and the season is basically half as long,joy,d use level job feel worthwhile season basically half long,2
i male are stupid first for woman cry babies and should get over it and you feel really cool for putting the stupid men in their place,joy,male stupid woman cry baby feel cool put stupid man place,2
i feel disgusted c kj rel bookmark class permalink nov middot,anger,feel disgusted c kj rel bookmark class permalink nov middot,0
i guess the trick is i need to go in strong and get what i want and not feel bashful over it,fear,guess trick need strong want feel bashful,1
i do not feel frantic,fear,feel frantic,1
i feel like a total bitchy person today yay,anger,feel like total bitchy person today yay,0
i always plant a big section of lettuce and i leave it open for those pesky bunnies so that they can feel all rebellious as if they are raiding my garden,anger,plant big section lettuce leave open pesky bunny feel rebellious raid garden,0
i was feeling very unsure as to whether or not i should continue to blog at all,fear,feel unsure continue blog,1
i haven t been able to shake this akward and unusual feeling i feel irritable and space out all the time feels like i was surged as well as my computer,anger,haven t able shake akward unusual feeling feel irritable space time feel like surge computer,0
i am now drunk again and feel fab,joy,drunk feel fab,2
i am feeling a little uncertain as i am waiting to hear from my land lady to confirm a date and receive my contract,fear,feel little uncertain wait hear land lady confirm date receive contract,1
i feel strange coming back to work after my one day holiday,fear,feel strange come work day holiday,1
i feel so lucky to have the opportunity to be here,joy,feel lucky opportunity,2
i was escorting a relative on a bike,fear,escort relative bike,1
im not necessarily sure what but something in the education system must change or students can feel anxiety and pressure with needing to be flawless with their vast knowledge of the world,joy,m necessarily sure education system change student feel anxiety pressure need flawless vast knowledge world,2
i needed to feel rebellious,anger,need feel rebellious,0
i didnt tell you because i didnt want you to feel afraid,fear,not tell not want feel afraid,1
i do not feel comfortable staying in my house i feel relentless when im asked to do something tired almost all the time and bored without my own money,joy,feel comfortable stay house feel relentless m ask tired time bore money,2
i may not be rich by material standards but i feel very rich because i am grateful for what i have,joy,rich material standard feel rich grateful,2
im also feeling cranky about it because the main characters scientist brother observing the moon mentions that there is zero gravity there,anger,m feel cranky main character scientist brother observe moon mention zero gravity,0
i did feel a little less inhibited in class tonight,fear,feel little inhibit class tonight,1
i am suddenly feeling very energetic,joy,suddenly feel energetic,2
i was a bit more bouncier than usual i didnt feel as grouchy about everything as normal,anger,bit bouncy usual not feel grouchy normal,0
i think i can finally articulate it the prius is in its own shiny happy al gore wearing patagonia in alaska way somewhat insidious in that it makes driving feel like a virtuous act,joy,think finally articulate prius shiny happy al gore wear patagonia alaska way somewhat insidious make driving feel like virtuous act,2
im feeling irritable and sick,anger,m feel irritable sick,0
i came home one day and discovered that my sister had borrowed my car and had gotten into an accident with it my entire front bumper was destroyed,anger,come home day discover sister borrow car get accident entire bumper destroy,0
i feel somewhat alarmed,fear,feel somewhat alarmed,1
i have written but you feel the need to point out that someone somewhere could be offended if they were to read my words out of context knowing nothing about me and after having a really bad day do not bother to inform me of this,anger,write feel need point offend read word context know have bad day bother inform,0
i was left feeling bothered by it for a long time afterwards,anger,leave feel bother long time,0
i feel like this could be a dangerous topic if anyone feels passionately about pianos but its been on my mind for a while and i thought it was worth discussing not because im going to paint my piano which i grew up with so please stop hyperventilating mom,anger,feel like dangerous topic feel passionately piano mind think worth discuss m go paint piano grow stop hyperventilate mom,0
i know its easy to twist things to create an explanation and im still not sure i have one but it did help me to feel a little less mad,anger,know easy twist thing create explanation m sure help feel little mad,0
i feel very dissatisfied with myself,anger,feel dissatisfied,0
i cough alot more and feel somewhat irritable at times,anger,cough alot feel somewhat irritable time,0
i feel like this concert was much more successful than the previous one,joy,feel like concert successful previous,2
i feel strange and weird about this entire struggle am i the only one who deals with this kind of conflict,fear,feel strange weird entire struggle deal kind conflict,1
i got inside it was so warm compared to the outside temp that my survivor man skills kicked in and i stripped down to my base layers to avoid feeling cold when i got back outside,anger,get inside warm compare outside temp survivor man skill kick strip base layer avoid feel cold get outside,0
im feeling at my creative best rather than that of a student who has a deadline to meet,joy,m feel creative good student deadline meet,2
ive been feeling a little frantic recently because our summer together is flying by so quickly,fear,ve feel little frantic recently summer fly quickly,1
i mean geez cara was raised not to feel compassion she had all love and feeling tortured and beaten from her at a very young age thats how the mord sith work,anger,mean geez cara raise feel compassion love feel torture beat young age s mord sith work,0
i am sharing information that i feel is important to personal safety and empowerment parenting and living well,joy,share information feel important personal safety empowerment parenting live,2
i try to remember that quote when i feel i may be hitting a wall in a marathon or even a training run and i know it is time to find that perfect song that fuel,joy,try remember quote feel hit wall marathon training run know time find perfect song fuel,2
i am feeling a little adventurous so i will try to see if we can spook our pretty lady,joy,feel little adventurous try spook pretty lady,2
i was just randomly talking about it and how i found the once more with feeling cd and listened to it and was quite eager to watch the show again,joy,randomly talk find feel cd listen eager watch,2
i met people from every corner of the globe so now when i am feeling restless and my finances will allow me i am can pick a spot see people that i really care about and have an adventure with them in their homelands,fear,meet people corner globe feel restless finance allow pick spot people care adventure homeland,1
i can do to that would truly express the utter gratitude and thankfulness i feel for your sincere gesture and i am very grateful,joy,truly express utter gratitude thankfulness feel sincere gesture grateful,2
i feel scared rather than curl up like a threatened porcupine,fear,feel scared curl like threatened porcupine,1
i feel no matter how convinced i am that i am all alone on this life journey of mine i am not alone,joy,feel matter convinced life journey,2
i am writing this i remember between feeling assured i wasnt dead and checking the window that me and my mom started fighting,joy,write remember feel assure not dead check window mom start fight,2
i left to the shower questioning what i feel she was gorgeous such a fantastic body so confident in her movement effortlessly graceful,joy,leave shower question feel gorgeous fantastic body confident movement effortlessly graceful,2
i feel intimidated like i just want to turn around and head back into the safety of my yoga class or hop on the tried and trusty treadmill,fear,feel intimidate like want turn head safety yoga class hop tried trusty treadmill,1
i write and share my feelings family events useful products good food exciting trips kitchen endeavors as well as occasional musings,joy,write share feeling family event useful product good food exciting trip kitchen endeavor occasional musing,2
i this feels rebellious to me,anger,feel rebellious,0
i remember a totally different feel having been a faithful dukes watcher growing up,joy,remember totally different feel having faithful duke watcher grow,2
im feeling confused but ill keep trudging through,fear,m feel confused ill trudge,1
i got my eyebrows waxed the other day and i feel glamorous,joy,get eyebrow wax day feel glamorous,2
i seriously feel uncomfortable,fear,seriously feel uncomfortable,1
i have learnt nothing else in the last two years it is that it s best to feel my way by trusting my instincts,joy,learn year s good feel way trust instinct,2
i will not go into details from that long night but i woke up for our am bus feeling like i could barely stand and not trusting the pit in my stomach,joy,detail long night wake bus feeling like barely stand trust pit stomach,2
im creature of feelings i evaluate life on my feelings dangerous,anger,m creature feeling evaluate life feeling dangerous,0
i kept feeling enraged that she was in too,anger,keep feel enrage,0
i feel a bit hesitant about the whole thing given my past two experiences and the fact that i m going to start a new novel while i work on my current wip because i feel like it would be cheating to count the words on my current wip even though i m only about words into it,fear,feel bit hesitant thing give past experience fact m go start new novel work current wip feel like cheat count word current wip m word,1
i wanted to not feel frightened anymore,fear,want feel frightened anymore,1
i can stop feeling jealous,anger,stop feel jealous,0
ive been feeling very indecisive lately,fear,ve feel indecisive lately,1
i didnt even have time to feel jealous i was so busy pinning her pictures and writing down a href http nanashi,anger,not time feel jealous busy pin picture write href http nanashi,0
i feel suspicious but i cant walk a way i like him i always had a thing for football players i know ive been m,fear,feel suspicious not walk way like thing football player know ve m,1
i was feeling anything but adventurous and stuck with comfort zone and ordered mcdonalds,joy,feel adventurous stuck comfort zone order mcdonald,2
i feel it rarely advances any worthwhile cause and i always stick to the rule of not posting anything online that i wouldnt be prepared to say to somebodys face,joy,feel rarely advance worthwhile cause stick rule post online not prepared somebodys face,2
i remember waking up feeling anxious and excited to read the bible its amazing how god will change your desires,fear,remember wake feel anxious excited read bible amazing god change desire,1
i feel like im in a really strange stage of my life right now as im entering my th year,fear,feel like m strange stage life right m enter th year,1
i suddenly feel anxious im crying over little things,fear,suddenly feel anxious m cry little thing,1
i was also feeling anxious around some of the people sitting in the waiting area,fear,feel anxious people sit waiting area,1
i feel like i m in some weird limbo between childhood and adulthood,fear,feel like m weird limbo childhood adulthood,1
i havent gotten them yet because i still resent paying dollars for a procedure that wasnt fully successful and since i wore glasses for years i feel ive been tortured enough,anger,not get resent pay dollar procedure not fully successful wear glass year feel ve torture,0
i just remember feeling so much pain and being confused and scared and convinced that i could not do this,fear,remember feel pain confused scared convince,1
i like her too much to feel as if im being obnoxious and getting involved into somethign that has nothing to do with me,anger,like feel m obnoxious getting involve somethign,0
i began to feel that it was shaken so badly that it would never be repaired,fear,begin feel shake badly repair,1
my roommate was rude to me,anger,roommate rude,0
i feel pleased about this issue there are a lot of beautiful pieces in it for example maggie lees poem titled a href http vol,joy,feel pleased issue lot beautiful piece example maggie lee poem title href http vol,2
im feeling slightly irritable but generally level headed and actually not in a bad mood,anger,m feel slightly irritable generally level head actually bad mood,0
i was feeling a little like a cold was coming on,anger,feel little like cold come,0
i have so much to be thankful for so to feel jealous of a skinny girl with a seemingly disposable income who is shopping at the mall seems so,anger,thankful feel jealous skinny girl seemingly disposable income shop mall,0
i am feeling very shaky today,fear,feel shaky today,1
i seem to wake up every day recently feeling immensely irritable and i cant quite work out why,anger,wake day recently feel immensely irritable not work,0
i tend to stop breathing when i m feeling stressed,anger,tend stop breathe m feeling stress,0
i remember feeling frantic at this point,fear,remember feel frantic point,1
im happy to have this in my kitchen but it feels like someone rushed this out and cut corners,anger,m happy kitchen feel like rush cut corner,0
i just feel strongly that i cannot condone violent methods to achieve a political goal,anger,feel strongly condone violent method achieve political goal,0
i like listening to hardcore sxe music its the one thing that lets me feel rebellious while not chocolating out or spending till its gone,anger,like listen hardcore sxe music thing let feel rebellious chocolate spend till go,0
i try to only buy fabrics that i would use in a project or that i feel are really fab,joy,try buy fabric use project feel fab,2
i feel i am determined to regain my routine i once had and of which i was so proud,joy,feel determined regain routine proud,2
i feel really disgusted with myself more than the pain and agony,anger,feel disgusted pain agony,0
ive been feeling far from perfect in the area of motherhood,joy,ve feel far perfect area motherhood,2
i recall seeing leaves falling off a tree set against a grey sky and feeling absolutely terrified,fear,recall see leave fall tree set grey sky feel absolutely terrified,1
i feel like i want to be very very rebellious until they regret of what they have done to their single daughter,anger,feel like want rebellious regret single daughter,0
i feel as though ive reached a point in my career where im highly respected there,joy,feel ve reach point career m highly respect,2
i absolutely love this skinny fiber it is doing wonders for me and i feel fabulous,joy,absolutely love skinny fiber wonder feel fabulous,2
i already feel the atmosphere around it seems dangerous,anger,feel atmosphere dangerous,0
i have an ironic feel i dont feel anything special but i still smile broadly whenever he tells me something,joy,ironic feel not feel special smile broadly tell,2
i mean i could literally feel him feeling content,joy,mean literally feel feel content,2
when my grandmother came to stay with us permanently as she is a very difficult person to stay with and when she started telling false stories about us to other people,anger,grandmother come stay permanently difficult person stay start tell false story people,0
i feel safe to leave my house in the morning,joy,feel safe leave house morning,2
i was feeling like a beluga whale and quite grouchy,anger,feel like beluga whale grouchy,0
when i was attacked by a teenage boy and had my wallet stolen,fear,attack teenage boy wallet steal,1
i feel smart telling people i like wally lamb because hes actually not chick lit so i always mention him so people will respect me more,joy,feel smart tell people like wally lamb s actually chick light mention people respect,2
when we stayed in vienna with our class,fear,stay vienna class,1
i feel like being distracted,anger,feel like distract,0
