Comment,Emotion,processed_comment,labeled_taget
i love my job and know that the surgeries were doing are emergencies i always feel resentful especially when it is am and i was sleeping,anger,love job know surgery emergency feel resentful especially sleep,0
i might be afraid to leave the house to nurse in public to commit to a social engagement or to wear anything that makes me look worse than i already feel so in honor of fearless friday i invite our newbie mom readers to do something that scares them,joy,afraid leave house nurse public commit social engagement wear make look bad feel honor fearless friday invite newbie mom reader scare,2
no description,anger,description,0
i do love life and i do love to laugh and i enjoy the funny side of things because honestly if i dont look at the funny side of things i would spend the majority of my life feeling pissed off over the stupid things that people do,anger,love life love laugh enjoy funny thing honestly not look funny thing spend majority life feeling piss stupid thing people,0
i feel inspired and eager to press on when the sun shines,joy,feel inspire eager press sun shine,2
i feel as if i m one of the stubborn ones,anger,feel m stubborn one,0
i only feel frightened and these are such small things,fear,feel frightened small thing,1
i feel paranoid when i wear makeup out,fear,feel paranoid wear makeup,1
i feel satisfied with it,joy,feel satisfied,2
im feeling you up grumpy,anger,m feel grumpy,0
i feel so uncertain all i did was crying over the phone saying i cant finish the reading,fear,feel uncertain cry phone say not finish reading,1
i have certainly been in places where i did not feel welcomed and i made a point to go on to a place where i did find that feeling of welcoming,joy,certainly place feel welcome point place find feeling welcome,2
i read too much about discovery and exploration in the wild west and while i feel that those concepts are precious taking part in them often myself this book just brings a refined feel when i sit back in the chair for some quiet time,joy,read discovery exploration wild west feel concept precious take book bring refined feel sit chair quiet time,2
i focus on the injustice the anger rises and i feel frustrated because i know i cannot change things on my own,anger,focus injustice anger rise feel frustrated know change thing,0
i have also always been afraid of the cold pool but i realized that it actually doesn t feel cold after about laps,anger,afraid cold pool realize actually doesn t feel cold lap,0
im feeling inspired by all the summery elements of my favorite past time beach bummin,joy,m feeling inspire summery element favorite past time beach bummin,2
i really dont feel very sociable in that bar anymore,joy,not feel sociable bar anymore,2
i must say though i have been feeling pretty violent,anger,feel pretty violent,0
i feel i just couldn t be bothered with some of the things that used to keep me up at night,anger,feel couldn t bother thing night,0
i feel really wonderful about myself and love the life i live,joy,feel wonderful love life live,2
i am known for letting things go when im not feeling good,joy,know let thing m feel good,2
im postponing feeling virtuous about this labor,joy,m postpone feel virtuous labor,2
i have essentially at least in my mind solved these design problems i just don t fucking feel like working them out in all their iterations i just feel like i can t be bothered leave that shit to the junior designers,anger,essentially mind solve design problem don t fucking feel like work iteration feel like t bother leave shit junior designer,0
i feel this product deserves a positive review i do want to leave you with a somewhat contradictory final thought,joy,feel product deserve positive review want leave somewhat contradictory final thought,2
i feel wronged by you over and over,anger,feel wrong,0
i woke up feeling shaky and nauseous with lots of cramping and pressure in my abdomen and pelvis,fear,wake feel shaky nauseous lot cramp pressure abdoman pelvis,1
i am feeling incredibly restless,fear,feel incredibly restless,1
ill admit it im bitchy sometimes but i feel as time goes by im getting more bitchy with him than my other relationships that went past the month mark,anger,ill admit m bitchy feel time go m get bitchy relationship go past month mark,0
i feel all glamorous,joy,feel glamorous,2
i feel like a snob but i ve been a bit skeptical of it from the start because i have no idea who kenny werner is and neither does thomas a musician who gave me the book,fear,feel like snob ve bit skeptical start idea kenny werner thomas musician give book,1
i kept staring at her quivering flower feeling that it was like a violent flower in time lapse photography a flower shivering with vigorous growth as it accelerated out to the flickering sun racing sky heralding the end of our relationship before it had even started,anger,keep stare quivering flower feel like violent flower time lapse photography flower shiver vigorous growth accelerate flicker sun racing sky herald end relationship start,0
i have been feeling very insincere,anger,feel insincere,0
i was feeling pretty hateful towards my refrigerator as i cleaned it,anger,feel pretty hateful refrigerator clean,0
i try to come up with ideas that i feel are clever to keep the my pieces fun to make and interesting to look at,joy,try come idea feel clever piece fun interesting look,2
when my mother kept me in leadingstrings,anger,mother keep leadingstring,0
i was feeling very keen to get out of the camp site before they realised i had been given the best gift of all free accommodation and free services,joy,feel keen camp site realise give good gift free accommodation free service,2
im feeling bouncy enough and if i can rustle up some people keen to go with me,joy,m feel bouncy rustle people keen,2
i feel that phrase implies a calm orderly procession in which i would remove the refuse from my,joy,feel phrase imply calm orderly procession remove refuse,2
i didnt feel there was anything special about it,joy,not feel special,2
i would not knowingly wound the feelings of any not even one who may have wronged me but would seek to do him good and make him my friend,anger,knowingly wound feeling wrong seek good friend,0
i love the feeling of running in the cold when you can see your breath and cold air seems to refresh you from the inside out,anger,love feeling run cold breath cold air refresh inside,0
i wanted to go and ask him about my batting but was feeling hesitant about approaching such a big player,fear,want ask batting feel hesitant approach big player,1
i am feeling a little nervous and anxious but never second guessing my decision,fear,feel little nervous anxious second guess decision,1
i detest feeling uncertain,fear,detest feel uncertain,1
i actually feel frightened of people here right now,fear,actually feel frightened people right,1
i feel as though i don t write about them often enough but they are just cruising through life in their own equally special ways,joy,feel don t write cruise life equally special way,2
i was feeling paranoid tonight so i had to check my blog stats,fear,feel paranoid tonight check blog stat,1
i managed a whole tuesday of eating clean but have caffeined up today and am feeling rather shaky,fear,manage tuesday eat clean caffeine today feel shaky,1
i think it affects me so much because it results back to one of my biggest flaws which is not feeling enough pretty enough smart enough you name it,joy,think affect result big flaw feel pretty smart,2
i have not spent that much time with them but i just don t feel that comfortable there,joy,spend time don t feel comfortable,2
i am sometimes confused as well for a moment in a time of need when the day to pay a bill has come and we dont have the money we need i sometimes feel confused as well,fear,confused moment time need day pay bill come not money need feel confused,1
i should go to sleep but i m feeling reluctant to let go of the day,fear,sleep m feel reluctant let day,1
i feel pressured helpless because i dont have control over this,fear,feel pressured helpless not control,1
ive been feeling reluctant intermittent and lacklustre to pen my thoughts down,fear,ve feel reluctant intermittent lacklustre pen thought,1
i am in front of a blank canvas i feel calm and focused,joy,blank canvas feel calm focus,2
i am i cant help but feel skeptical about the whole thing,fear,not help feel skeptical thing,1
i did feel slightly shaky and had a headache,fear,feel slightly shaky headache,1
i don t know if he knew about buffy but i for one was feeling nervous about how the whole multiple dogs on a flight thing was going to pan out,fear,don t know know buffy feel nervous multiple dog flight thing go pan,1
i have the dried bladders all ready for a day im feeling brave,joy,dry bladder ready day m feel brave,2
i feel more clever,joy,feel clever,2
i feel very apprehensive to adopt labels and to even identify myself as queer it seems that im still quite unclear on that subject and it keeps me feeling separate from the queer community like joel,fear,feel apprehensive adopt label identify queer m unclear subject keep feel separate queer community like joel,1
i feel uptight my day is complete when hes around i feel so right a little nervs i dream about what we can do date and all the things we can pursue wedding i always dream that your mine very day min,fear,feel uptight day complete s feel right little nervs dream date thing pursue wedding dream day min,1
im sorry this apparently offends a lot of other women because its only women who feel the need to say something rude but im going to do it anyway,anger,m sorry apparently offend lot woman woman feel need rude m go,0
i know ive talked about this before and i know that eric has talked about how the same thing happened on his mission just how like sometimes you feel like you get super overwhelmed by all the stuff you have to do and its just so easy to be really hard on yourself the mental game if you will,joy,know ve talk know eric talk thing happen mission like feel like super overwhelmed stuff easy hard mental game,2
i had a very provocative dream the kind that makes you feel slightly shaken as you wake up from it,fear,provocative dream kind make feel slightly shake wake,1
i feel still very honoured and i am deeply thankful that i was granted this opportunity,joy,feel honoured deeply thankful grant opportunity,2
i was feeling a bit annoyed but it didnt really affect me very much,anger,feel bit annoyed not affect,0
i am feeling grumpy i put this on,anger,feel grumpy,0
i headed there fully expecting them to have been sold out ages ago and that i would find myself staggering back upstairs without them feeling all bitter twisted and disappointed but at least with some of the allocated pennies still lurking in my own bank account,anger,head fully expect sell age ago find stagger upstairs feel bitter twisted disappointed allocate penny lurk bank account,0
im feeling suitably annoyed by the panel and its time to get you a recipe for these previously deemed unworthy treats,anger,m feel suitably annoy panel time recipe previously deem unworthy treat,0
i feel poisoned and tortured by this room,fear,feel poison torture room,1
i thought he was just the type that doesn t show his feelings i laughed and convinced myself that i don t know what s happening beyond closed doors so who am i to make conclusions,joy,think type doesn t feeling laugh convince don t know s happen closed door conclusion,2
i began to feel bitter towards them,anger,begin feel bitter,0
i get a little twitchy when i feel like someone is depending on me and i have to have a flawless job done in the end,joy,little twitchy feel like depend flawless job end,2
i do not feel that i could ever harm an innocent girl in such a way never have i imagined such dire consequences for not doing so,joy,feel harm innocent girl way imagine dire consequence,2
i feel hateful sometimes,anger,feel hateful,0
i started feeling festive a little early this year,joy,start feel festive little early year,2
i like to pull out when i ever i feel like being snobbish about my musical tastes,anger,like pull feel like snobbish musical taste,0
im going to sleep now while i still feel triumphant,joy,m go sleep feel triumphant,2
im kind of feeling nervous and anxious about all the shit i have to do today,fear,m kind feel nervous anxious shit today,1
i was feeling very vulnerable and down no one really close to me has ever died before i either hadnt known them very well or was too young to remember,fear,feel vulnerable close die not know young remember,1
i dont know what mediation means to everyone else but to me this process only has value if i freely express how i feel and as this will inevitably leave me feeling vulnerable and exposed the longer the delay the more i can feel anxiety building,fear,not know mediation mean process value freely express feel inevitably leave feel vulnerable expose long delay feel anxiety building,1
i feel spiteful toward him,anger,feel spiteful,0
i feel glad that justice will be served west said,joy,feel glad justice serve west say,2
i also feel like i was being way too irritable today,anger,feel like way irritable today,0
i dont think he is being honest with me about a lot of things i could be wrong here but i keep feeling skeptical about certain things after everytime i hang out with him,fear,not think honest lot thing wrong feel skeptical certain thing everytime hang,1
i always feel that it is profoundly worthwhile,joy,feel profoundly worthwhile,2
i suppose we had these moments of feeling vulnerable together and we laughed a lot and i felt very alive,fear,suppose moment feel vulnerable laugh lot feel alive,1
ive been frustrated that i dont walk around floating on air seeing the good in every sidewalk pothole i trip into beating myself up over feeling unsure and scared,fear,ve frustrate not walk float air see good sidewalk pothole trip beat feel unsure scared,1
i still feel like the admission that i don t like this popular show puts me in a category with people who kick puppies or people who or who steal the ratty clothes off the backs of dickensian orphans,joy,feel like admission don t like popular put category people kick puppy people steal ratty clothe back dickensian orphan,2
i feel really nervous about losing it i print the file out on to paper as a final security,fear,feel nervous lose print file paper final security,1
i lets me into his fucked up world and he usually does i feel fucked up too and honestly a little scared,anger,let fuck world usually feel fuck honestly little scared,0
i feel vulnerable and alone,fear,feel vulnerable,1
i feel so honoured to have hosted this series to have such talented a,joy,feel honoured host series talente,2
i feel that it is dangerous to portray angels as walking the earth and intermarrying with humans,anger,feel dangerous portray angel walk earth intermarry human,0
i feel rebellious a little annoyed mad caged in,anger,feel rebellious little annoyed mad cage,0
i feel everything is in control then i am ok,joy,feel control ok,2
i have an overwhelming feeling of sadness that there are people in this world that are so hateful,anger,overwhelming feeling sadness people world hateful,0
i feel like my valuable college years are being wasted in daily routine,joy,feel like valuable college year waste daily routine,2
i compare your beauty i feel unsure where to begin to angels or nature or what,fear,compare beauty feel unsure begin angel nature,1
i hate even doing this because i feel like it s rude but i must say i love the blog it came from and this is no insult to the food photography because i enjoy it,anger,hate feel like s rude love blog come insult food photography enjoy,0
i am feeling shaky and tired i feel like i do when i go on a long run without eating and come home and just really wanting a banana or some gatorade,fear,feel shaky tired feel like long run eat come home want banana gatorade,1
i understand but i feel like i hated my friends,anger,understand feel like hate friend,0
i feel insulted that he doesnt know me better than that,anger,feel insult not know well,0
i should probably mention so that you aren t feeling left out that the lunch was in celebration of the top participants of the take the lead speech competition another reason to enter the competition the food was delicious and the conversation was amusing,joy,probably mention aren t feeling leave lunch celebration participant lead speech competition reason enter competition food delicious conversation amusing,2
i feel paranoid that every time i log onto facebook or attend church that im about to find out yet another friend is pregnant,fear,feel paranoid time log facebook attend church m find friend pregnant,1
i was feeling pretty cranky and down and all i could think of what how much better i feel when i cut my hair off,anger,feel pretty cranky think well feel cut hair,0
im feeling so distracted recently,anger,m feel distracted recently,0
i usually feel suspicious and guilty about this considering how little i do during my work day,fear,usually feel suspicious guilty consider little work day,1
i feel greedy part comes in,anger,feel greedy come,0
i always liked the winter season i feel that im well adapted to cold weather,joy,like winter season feel m adapt cold weather,2
i was feeling resentful enough to want to write about it here which means i need to work on look getting my hackles raised when others judge me,anger,feel resentful want write mean need work look get hackle raise judge,0
i feel very confused and cant stop myself from digging in a bit more,fear,feel confused not stop dig bit,1
i told her yeah they feel insecure and they bully people because it makes them feel powerful physically,fear,tell yeah feel insecure bully people make feel powerful physically,1
i feel glamorous rich enough for enriching my perfume collection even more haha,joy,feel glamorous rich enrich perfume collection haha,2
im currently in a phase of feeling very positive and optimistic about graduation though that tends to range on a daily basis between euphoria and deep deep depression so no bets on how ill feel about it tomorrow,joy,m currently phase feel positive optimistic graduation tend range daily basis euphoria deep deep depression bet ill feel tomorrow,2
i hope the pair of us harbor no hard feelings and do enjoy casual chats about the ways our lives turn out without needing to press a title into everything,joy,hope pair harbor hard feeling enjoy casual chat way life turn need press title,2
ive been feeling distressed,fear,ve feel distressed,1
i finish typing this post i realise i m ok no longer do i feel annoyed angry or even sad,anger,finish type post realise m ok long feel annoyed angry sad,0
i was feeling a little adventurous and ordered the seafood paella and lemonade and after the drink arrived i kicked myself as i should have ordered a glass of sangria,joy,feel little adventurous order seafood paella lemonade drink arrive kick order glass sangria,2
i laughed then bitterly again but i wasnt feeling bitter,anger,laugh bitterly not feel bitter,0
i sat there for a while listening to the wind blow through the trees feeling so calm until she was finally ready to come,joy,sit listen wind blow tree feel calm finally ready come,2
i was feeling grouchy and upset about a situation with a girl which wasn t going how i d hoped,anger,feel grouchy upset situation girl wasn t go d hope,0
im not much of a people watcher or a voyeur so i feel kinda weird when walking around taking street shots,fear,m people watcher voyeur feel kinda weird walk take street shot,1
i see women wearing boots i feel envious that i want to curse them,anger,woman wear boot feel envious want curse,0
i want to please him but i feel resentful that he doesn t get how exhausted i feel all the time and how painful it is for me when i m not warmed up properly,anger,want feel resentful doesn t exhausted feel time painful m warm properly,0
i remember feeling so calmed and at ease because even though we had just a few minutes of good light i felt your confidence and determination to get the best possible shots and that made all the difference in the world to me,joy,remember feel calmed ease minute good light feel confidence determination good possible shot difference world,2
i feel skeptical now,fear,feel skeptical,1
i cant help but feeling a little hesitant about my decision just because of the magnitude of the decision,fear,not help feel little hesitant decision magnitude decision,1
i feel very vulnerable about sharing things that i write but i hit the publish button anyway,fear,feel vulnerable share thing write hit publish button,1
i guess just like a porn star looking at a inch rubber dong i m feeling a bit hesitant about the whole thing,fear,guess like porn star look inch rubber dong m feel bit hesitant thing,1
i feel weird having to yank it down and readjust it at points,fear,feel weird have yank readjust point,1
i was also worried about the long trip because i had vomited the night before and as you may guess im not feeling well at all,joy,worried long trip vomit night guess m feel,2
i like the feeling of making some difference this time i was really reluctant to change at first however get used to it after a while,fear,like feeling make difference time reluctant change,1
i have to confess to feeling quite angry when i read some of the negative reviews of uses for boys some of which are basically victim blaming and slut shaming,anger,confess feel angry read negative review use boy basically victim blaming slut shame,0
i did feel a bit like i was being mircowaved which wasnt an entirely pleasant feeling,joy,feel bit like mircowave not entirely pleasant feeling,2
i feel was not acceptable and had this been better would of allowed me to meet the needs of some of the students in a more targeted way,joy,feel acceptable well allow meet need student targeted way,2
i feel so strange sitting here blogging away amp not having to study,fear,feel strange sitting blogge away amp have study,1
i feel so highly intimidated that i get flustered and cant form my words not even in english with her,fear,feel highly intimidate fluster not form word english,1
i feel like theyre perfect if youre too lazy to fix your hair,joy,feel like perfect lazy fix hair,2
i was actually feeling very distressed,fear,actually feel distressed,1
i repeat over and over in my life in which i try to take control in my life but it when it doesn t work i feel afraid that i have no control,fear,repeat life try control life doesn t work feel afraid control,1
i still have such a hard time writing my work down and when i do i feel its not perfect,joy,hard time write work feel perfect,2
i love this projector it is old it has an old smell to it not displeasing just old and slightly musty it is from the early s i feel like i am in my own little episode of mad men when we set it up to watch something on it,anger,love projector old old smell displease old slightly musty early s feel like little episode mad man set watch,0
i really lose a lot of my nesting homemaking instinct and desire when i am pregnant and the longer im pregnant the worse it gets though i do get about a month reprieve where i feel creative again around the six month mark and youll notice that is when i did a post for halloween,joy,lose lot nesting homemaking instinct desire pregnant long m pregnant bad get month reprieve feel creative month mark ll notice post halloween,2
i feel so pretty and glamorous,joy,feel pretty glamorous,2
i feel like i should be hated and that everything that has happened to me is what i deserve,anger,feel like hate happen deserve,0
i want to come out about it but i feel so reluctant for some reason,fear,want come feel reluctant reason,1
im not feeling violent im feeling creative with weapons,anger,m feel violent m feel creative weapon,0
i would give up feeling fucked to feel neutral,anger,feeling fuck feel neutral,0
i could say that will make anyone feel better than actually reaching their goal themselves,joy,feel well actually reach goal,2
i say that i feel like im being tortured by him,anger,feel like m torture,0
i dont know where and when i can feel the thrill and im scared that im going to miss it,fear,not know feel thrill m scared m go miss,1
i cant help looking back on the child i was and feeling rather jealous but i am also delighted to be living in a time when a nine year old child in some parts of the world can read a thousand books a year if she he wishes and is able to,anger,not help look child feel jealous delighted live time year old child part world read thousand book year wish able,0
i feel like a savage when i eat meat but i wouldve eaten my own hand if i couldnt have some of that turkey,anger,feel like savage eat meat ve eat hand not turkey,0
i feel selfish but i think it s about time i was,anger,feel selfish think s time,0
im feeling awfully spiteful right now,anger,m feel awfully spiteful right,0
i got caught shoplifting a package of gummy bears,fear,get catch shoplift package gummy bear,1
i feel like pulling a paige from charmed just dont hurt me ok,joy,feel like pull paige charm not hurt ok,2
i feel delighted toward something it could be an acheivment i did or my surrounding or even unexpected event that happen to me,joy,feel delighted acheivment surrounding unexpected event happen,2
i said in some recent interviews we will have two guests on the next alcest album and today i feel glad to reveal the first one,joy,say recent interview guest alcest album today feel glad reveal,2
i am feeling anxious that im not out watching this important game that im avoiding a bar because of an asshole who broke my heart and that im missing out meeting cute boys,fear,feel anxious m watch important game m avoid bar asshole break heart m miss meet cute boy,1
