Comment,Emotion,processed_comment,labeled_taget
ive had a rather average career because i decided to work less to earn less no rolex anywhere to be seen but have managed to write and even publish some of the short story collections and novels i have in my mind and on my drafts today i will feel successful,joy,ve average career decide work earn rolex see manage write publish short story collection novel mind draft today feel successful,2
i have made a few sets of his and hers wedding rings recently and i always feel so honored to be asked to make what is probably the most personal piece of jewellery that anyone ever buys,joy,set wedding ring recently feel honored ask probably personal piece jewellery buy,2
i can hear the hum you make at the feeling of my warmth and my legs shift a little in a strange need,fear,hear hum feeling warmth leg shift little strange need,1
im feeling a little apprehensive about this party,fear,m feel little apprehensive party,1
i feel that the session was useful and gave me tools i need to move forward in my life,joy,feel session useful give tool need forward life,2
i just feel like weve been living in a weird time warp like its only wednesday,fear,feel like ve live weird time warp like wednesday,1
i was that i bombed that first interview i left the second interview feeling pretty fan freaking tastic,joy,bomb interview leave second interview feel pretty fan freaking tastic,2
i can tell most of the time what shes really feeling and she was being really sincere,joy,tell time s feel sincere,2
i feel like im more hated than celebrated and i cant wait till the day i can say i made it,anger,feel like m hate celebrate not wait till day,0
i just grab something and hit myself just to feel pain damn i know the risks and injuries that might occur i know its dangerous,anger,grab hit feel pain damn know risk injury occur know dangerous,0
i feel about myself is so fucked up,anger,feel fuck,0
i often feel the need to defend just about anything even in casual conversation like blue s from the color code are usually christmas fanatics and i jump in and,joy,feel need defend casual conversation like blue s color code usually christmas fanatic jump,2
i feel hesitant because i don t want to put too much stock in the possibility that maybe today marks the end of a hard year and the start of one that might be better,fear,feel hesitant don t want stock possibility maybe today mark end hard year start well,1
i constantly feel lied to and wronged by them i love these people to death,anger,constantly feel lie wrong love people death,0
im feeling afraid,fear,m feel afraid,1
im particularly feeling pressured to act and behave in ways that are culturally accepted and expected of me,fear,m particularly feel pressure act behave way culturally accept expect,1
i think that even just understanding that there s that history behind it it lends to the explanation of where it s being projected from so it s kind of important to some degree and i never feel offended by people questioning that,anger,think understand s history lend explanation s project s kind important degree feel offend people question,0
i would cry scream kick at the door and feel terrified,fear,cry scream kick door feel terrified,1
im feeling rebellious for the sake of being rebellious,anger,m feel rebellious sake rebellious,0
i was feeling very festive i decided to paint my nails for the holiday events,joy,feel festive decide paint nail holiday event,2
i was feeling joy happiness ecstasy triumph or love i felt contented somehow,joy,feel joy happiness ecstasy triumph love feel content,2
i feel overwhelmed or a little blue usually around that time of the month but i manage those feelings well,fear,feel overwhelmed little blue usually time month manage feeling,1
i feel like a greedy easily pound overweight american,anger,feel like greedy easily pound overweight american,0
i hurt their feelings for refusing to listen to their spiteful hurtful sniping at others,anger,hurt feeling refuse listen spiteful hurtful sniping,0
i feel threatened by not talking about it,fear,feel threaten talk,1
i know and trust how i feel but i generally shy away from it with strangers,fear,know trust feel generally shy away stranger,1
i feel insulted but i go out with him anyway,anger,feel insulted,0
im feeling so insecure financially right now that i dont want to spend the,fear,m feel insecure financially right not want spend,1
i want others to be happy but does that mean i step back yet again it feels like and allow them to be happy because they deserve it or do they even deserve it or do i,joy,want happy mean step feel like allow happy deserve deserve,2
i am so happy but yet i feel enraged,anger,happy feel enraged,0
i am feeling a bit agitated or stressed i find a surprising amount of relief from cleaning and decluttering my house or even just a small space like a closet,fear,feel bit agitated stress find surprising relief clean decluttere house small space like closet,1
i feel so hesitant posting them,fear,feel hesitant post,1
i look out on this scene i think about how cute it is and enjoy a swelling feeling of pride in the playful delight of my dog,joy,look scene think cute enjoy swell feeling pride playful delight dog,2
i feel heartless in saying so though,anger,feel heartless say,0
i really hate that feeling when youre unsure about something,fear,hate feeling unsure,1
i feel agitated and jumpy and like i just ate a bottle of caffeine pills,fear,feel agitated jumpy like eat bottle caffeine pill,1
i almost didn t want to post these because i can sometimes feel intimidated by the amazingness of other mom bloggers who seem to have perfectly organized homes and entertained children,fear,didn t want post feel intimidate amazingness mom blogger perfectly organize home entertained child,1
every time i meet a certain dog that has once bitten me,fear,time meet certain dog bite,1
i feel really honored and excited to have met her,joy,feel honored excited meet,2
i feel relieved because finally i can move on without a single tear shed,joy,feel relieved finally single tear shed,2
i must admit no matter how early i start playing christmas music and doing my holiday shopping the tree makes everything feel so much more holly and jolly,joy,admit matter early start play christmas music holiday shop tree make feel holly jolly,2
i woke on saturday feeling a little brighter and was very keen to get outdoors after spending all day friday wallowing in self pity,joy,wake saturday feel little bright keen outdoors spend day friday wallow self pity,2
i feel like our relationship revovles around sex and when we do he wants it to be really adventurous trying new things using toys etc ansi just find it exhausting trying to keep up,joy,feel like relationship revovle sex want adventurous try new thing toy etc ansi find exhaust try,2
i feel like i can take on the world and even if it says no to me i wont be afraid and will not be discouraged,fear,feel like world say will not afraid discourage,1
i havent known sue anything like as long as bloater and lisa but i feel like i have you know one of those people you meet and you just click with you can have grumpy old people conversations straight away with them but then roll around laughing the next minute well thats sue,anger,not know sue like long bloater lisa feel like know people meet click grumpy old people conversation straight away roll laugh minute s sue,0
i did manage two short runs and a walk but today im back to feeling just shy of awful,fear,manage short run walk today m feel shy awful,1
i feel fucked is available to pre order from a href http churchoffuck,anger,feel fuck available pre order href http churchoffuck,0
i started to feel that irritated feeling,anger,start feel irritated feeling,0
ive planned and there are still days when i feel stressed to the point of tears and helpless but the good far outweighs the bad and i can honestly say that im happy in this moment,anger,ve plan day feel stressed point tear helpless good far outweigh bad honestly m happy moment,0
first anatomy lesson,anger,anatomy lesson,0
i feel like i had so much to write then got distracted by my home on a wednesday evening challenge and have therefore lost my train of thought,anger,feel like write get distract home wednesday evening challenge lose train thought,0
i feel a cold coming on or drink a little extra xango juice when i am stiff and sore,anger,feel cold come drink little extra xango juice stiff sore,0
i guess the mild pain had made me feel even more impatient to just get on with it,anger,guess mild pain feel impatient,0
i saw that i had the last spot on the tour and that i was going to be wrapping the whole thing up i must admit to feeling a little intimidated,fear,see spot tour go wrap thing admit feel little intimidated,1
i feel like i ve been distracted all day or i ve been dealing more with fiddly necessities than actual creative work then i ll feel like the day s been wasted,anger,feel like ve distract day ve deal fiddly necessity actual creative work ll feel like day s waste,0
i continue to feel nervous inside and long to talk sensibly even just one time around someone its so wrong to have these feelings for on so many levels i have no clue,fear,continue feel nervous inside long talk sensibly time wrong feeling level clue,1
i find myself feeling irritable or depleted i run through a mental checklist have i worked out,anger,find feel irritable deplete run mental checklist work,0
i was feeling threatened that it might be taken away from me,fear,feel threaten take away,1
i remember feeling uncertain about myself when i was young and especially when i became a teenager,fear,remember feel uncertain young especially teenager,1
i have found the perfect remedy for anyone feeling stressed or conflicted about the future its the a href http www,anger,find perfect remedy feel stressed conflict future href http www,0
i didnt feel insulted though,anger,not feel insult,0
i feel offended when friends especially married friends somehow judge me for not being married yet,anger,feel offended friend especially married friend judge marry,0
im feeling insecure and sad because i dont know what to do with my book,fear,m feel insecure sad not know book,1
i feel like a little kid whose mom is proud that they touched the soccer ball once during the game,joy,feel like little kid mom proud touch soccer ball game,2
i am comforted knowing that i can use my gun for my protection and will not be put behind bars for using it when i feel threatened,fear,comfort know use gun protection bar feel threatened,1
i feel about this totally and completely pissed angry sad disappointed and absolutely furious at tough mudder the biggest rip off on planet earth,anger,feel totally completely piss angry sad disappointed absolutely furious tough mudder big rip planet earth,0
im feeling virtuous i do a spinach feta cranberry salad with balsamic viniagrette,joy,m feel virtuous spinach feta cranberry salad balsamic viniagrette,2
i seriously still feel so insecure and dreadful that the new guy would suddenly pop back up and change things,fear,seriously feel insecure dreadful new guy suddenly pop change thing,1
i know that feeling for sure,joy,know feel sure,2
i think im just being stupid feeling nervous,fear,think m stupid feel nervous,1
i feel we re seeing now is a clash between those who are very alarmed at the changes in our planet and those who are rather laconic about the whole thing,fear,feel see clash alarmed change planet laconic thing,1
i feel a remembrance of the strange by justin aryiku falls into the latter category,fear,feel remembrance strange justin aryiku fall category,1
i feel the echoes of the divine so very close,joy,feel echo divine close,2
i like to participate in sketch challenges from time to time when im feeling inspired,joy,like participate sketch challenge time time m feeling inspire,2
in sweden,fear,sweden,1
i also feel aggravated i have an embarassing reason i dont want to go home yet i dreaded coming here and now im dreading leaving here,anger,feel aggravate embarassing reason not want home dread come m dread leave,0
i see lovers i feel envious i want someone to be there for me,anger,lover feel envious want,0
i feel offended and sad because they do not know their ignorance,anger,feel offended sad know ignorance,0
i feel she s frantic about controlling her message wary of others readings fearful of what meaning they might find and or create in her performance,fear,feel s frantic control message wary reading fearful mean find create performance,1
im feeling that kind of feeling when you are confused yet like bleh,fear,m feel kind feeling confused like bleh,1
i have the feeling she was amused and delighted,joy,feeling amuse delight,2
when it became clear that a man had used many people sexually and psychologically,anger,clear man people sexually psychologically,0
i feel paranoid but atleast now i get some comfort with dd she is the only person that i can talk to and not feel lie total crap around she is the nicest kindest most caring person i have ever met and i dont think that i will ever find anyone as great as her in my life,fear,feel paranoid atleast comfort dd person talk feel lie total crap nicest kind caring person meet not think find great life,1
i had climbed on a cherry tree alone and there was a thick caterpillar beside my fingers i feel disgusted by caterpillars and snakes i was terribly afraid of the caterpillar crawling on my fingers out of the fear i was almost unable to climb down,fear,climb cherry tree thick caterpillar finger feel disgust caterpillar snake terribly afraid caterpillar crawl finger fear unable climb,1
i think it is possible maybe i am denying it maybe i am not opening myself up to the whole possibility maybe it is only just now i have realised that it is possible to give a man men that power over me to make me feel shaken in my leather sandals,fear,think possible maybe deny maybe open possibility maybe realise possible man man power feel shake leather sandal,1
i feel like a person who tortured somebody because i like to see the fans confused and embarrassed at the same time,fear,feel like person torture somebody like fan confuse embarrassed time,1
i wasnt feeling well yesterday and today has been randomly busy,joy,not feel yesterday today randomly busy,2
i feel jealous when i know he go out with other women,anger,feel jealous know woman,0
i stand by that he is actually annoying giggle i also acknowledge that i have been feeling very dissatisfied,anger,stand actually annoying giggle acknowledge feel dissatisfied,0
i feel invigorated by the,joy,feel invigorate,2
i feel so selfish but i just want to keep my baby close for awhile and not let the rest of the world in unless i feel like it,anger,feel selfish want baby close awhile let rest world feel like,0
i really do feel for kids who are tortured in highschool,fear,feel kid torture highschool,1
i rid myself of many bad habits only to fall back into them when i feel insecure or vulnerable,fear,rid bad habit fall feel insecure vulnerable,1
i am feeling vulnerable worrying that the publishing world doesn t like my stories and won t like this next one if i write it,fear,feel vulnerable worry publish world doesn t like story win t like write,1
i feel that i was innocent i did not want to hurt anyone,joy,feel innocent want hurt,2
i feel better about myself almost tasting my success,joy,feel well taste success,2
i don t like feeling vulnerable or exposing all my worries and concerns mostly because i have felt the need to hold it together to be the strong one,fear,don t like feel vulnerable expose worry concern feel need hold strong,1
i always feel a little shy in those situations and then nervous that my shyness is making me seem aloof,fear,feel little shy situation nervous shyness make aloof,1
i feel that the classroom is extremely dangerous,anger,feel classroom extremely dangerous,0
im feeling festive tonight,joy,m feel festive tonight,2
i fully enjoy music when i feel afraid using headphones,fear,fully enjoy music feel afraid headphone,1
i feel impatient to do a final post after four more weeks with tangible results so far its exciting to see how far the philips reaura can go in terms of firming and smoothing,anger,feel impatient final post week tangible result far exciting far philip reaura term firm smooth,0
i feel that being faithful isnt enough in your eyes,joy,feel faithful not eye,2
i know is that right now i feel like i am still in th grade trying to be as useful as my little legs will let me be,joy,know right feel like th grade try useful little leg let,2
i want to enjoy this and feel successful,joy,want enjoy feel successful,2
i created my how to paint an owl e course with the intention of sharing the simple shape templates that i use to start my own owls so that others could easily create their own and not feel afraid to start on a blank canvas,fear,create paint owl e course intention share simple shape template use start owl easily create feel afraid start blank canvas,1
i feel radiant this morning,joy,feel radiant morning,2
ill feel lively again,joy,ill feel lively,2
i reply because they make me feel pretty,joy,reply feel pretty,2
i sit here tonight i m pensive tense and feeling a little fearful,fear,sit tonight m pensive tense feel little fearful,1
i tend to think that it kinda contributed to my medium intelligence and made me understand and feel things in a clever and sensible way in the visual arts field especially but i m always feeling that i m losing that more and more,joy,tend think kinda contribute medium intelligence understand feel thing clever sensible way visual art field especially m feel m lose,2
i spoke with reported feeling dissassociated and dissatisfied with their human lives,anger,speak reported feeling dissassociate dissatisfied human life,0
i feel really wronged in fact what hu jia did is good for society,anger,feel wrong fact hu jia good society,0
i wonder how they would feel if someone was screaming at them and then saying horribly rude things behind their back later,anger,wonder feel scream say horribly rude thing later,0
i have a feeling this month is going to have some damn cool things in store,joy,feeling month go damn cool thing store,2
i feel tortured being a person because no one in the world even think im somebody i wish there will be somebody out there wishing is just a waste of time though i dream too for somebody but its just the same tortured,fear,feel torture person world think m somebody wish somebody wish waste time dream somebody torture,1
staying alone in the biology building after the dark,fear,stay biology building dark,1
im feeling a little grumpy today with the lame weather tease we got over the weekend,anger,m feel little grumpy today lame weather tease get weekend,0
i feel glad to have my little blog to share with you the dangers i see on the path ahead,joy,feel glad little blog share danger path ahead,2
i have a feeling my view isnt going to be very popular and thats fine,joy,feeling view not go popular s fine,2
i was feeling nervous sure just like anyone else would be in my position,fear,feel nervous sure like position,1
i also get to feel proud of my weight loss which when completed in a few months time i will have lost around kg which is approx pounds,joy,feel proud weight loss complete month time lose kg approx pound,2
i could feel myself hit this strange foggy wall,fear,feel hit strange foggy wall,1
i guess i would feel more like joseph with walt trusting me to care for mother and over the finances which he did six months before he died there are times i want to defend my self but god makes me be quiet,joy,guess feel like joseph walt trust care mother finance month die time want defend self god make quiet,2
i feel the need to emphasize these things at the moment because of how grumpy i have been this last week,anger,feel need emphasize thing moment grumpy week,0
i don t like the idea that women in the entertainment industry especially in pop music may feel pressured to turn themselves into hypersexual tartlets but i get the feeling that rihanna isn t being provocative because she feels she has to,fear,don t like idea woman entertainment industry especially pop music feel pressured turn hypersexual tartlet feeling rihanna isn t provocative feel,1
i feel the eyes on me the hateful eyes on the other side of the glass that belong to the family members of my beautiful victims,anger,feel eye hateful eye glass belong family member beautiful victim,0
i spend time dating or attempting to date only to end up feeling confused,fear,spend time date attempt date end feel confused,1
i first held my scotty i knew i was in love with my high priced bundle of joy but i couldnt help feeling apprehensive about what the time to come holds,fear,hold scotty know love high price bundle joy not help feel apprehensive time come hold,1
im feeling in my heart to make my list of things that i am thankful for,joy,m feel heart list thing thankful,2
i dont know how to explain it very well its like i am happily bobbing along exploring an abstract universe all on my own but when i make contact with something i get excited and happy and i feel satisfied like ive formed a special bond with whatever ive encountered,joy,not know explain like happily bob explore abstract universe contact excited happy feel satisfied like ve form special bond ve encounter,2
i talk about in this essay is that people feel differently about poetry when they re angry or sad,anger,talk essay people feel differently poetry angry sad,0
i get giddy over feeling elegant in a perfectly fitted pencil skirt,joy,giddy feel elegant perfectly fit pencil skirt,2
i feel so special when im wearing this front,joy,feel special m wear,2
i may pour out the half empty cup here i will still be making significantly less than i was making at the age of fresh out of college is an entire dollar and some change more an hour which feels like sweet desperate progress,joy,pour half cup make significantly make age fresh college entire dollar change hour feel like sweet desperate progress,2
i posted this lovely picture on instagram and was feeling slightly rebellious walking on that plane feeling,anger,post lovely picture instagram feel slightly rebellious walking plane feeling,0
ive predicted angle to win and im feeling slightly less grumpy than when i wrote that lets say that gallows wins clean here to keep things tight,anger,ve predict angle win m feel slightly grumpy write let gallow win clean thing tight,0
i need nine hours but it s true and if i get less even seven hours which is supposed to be the norm and which some people consider a lot i feel grumpy unhappy and seriously unmotivated,anger,need hour s true seven hour suppose norm people consider lot feel grumpy unhappy seriously unmotivated,0
i almost feel greedy for believing that i want so much,anger,feel greedy believe want,0
i was feeling really emotionally distraught and unable to concentrate,fear,feel emotionally distraught unable concentrate,1
i grabbed him by the collar and pulled him against me in a passionate tonguey kiss feeling his long member slide between my waiting ass cheeks as it pulsed on the frantic bud of my clit,fear,grab collar pull passionate tonguey kiss feel long member slide wait ass cheek pulse frantic bud clit,1
i feel threatened i feel fear,fear,feel threaten feel fear,1
i feel even more pressured to cook healthy meals and not eat out do thorough preschool lessons with my boys keep the house spotless exercise serve the church and community and be a happy loving wife at all times,fear,feel pressured cook healthy meal eat thorough preschool lesson boy house spotless exercise serve church community happy love wife time,1
i loved a person and he went away it wasnt necessary that he left me to reach his goals,anger,love person go away not necessary leave reach goal,0
i feel bitter to see what i ve become,anger,feel bitter ve,0
i feel soooo impatient,anger,feel soooo impatient,0
i love how i can feel totally distressed and hopeless but when i put on a bright eyes record or something all of a sudden i have this realization that there is more to life than the shit i worry about,fear,love feel totally distressed hopeless bright eye record sudden realization life shit worry,1
i almost feel greedy with my rd child when so many people i know are working so hard for or,anger,feel greedy rd child people know work hard,0
i love this because to me it should leave the reader feeling confused and slightly deceived,fear,love leave reader feel confused slightly deceive,1
i do know the main reason i feel like i m losing myself unsure if i ll ever get those pieces back but i m not quite ready to talk about that just yet,fear,know main reason feel like m lose unsure ll piece m ready talk,1
i feel so uncertain about the decade ahead,fear,feel uncertain decade ahead,1
i feel anxious and worry just in case i dont understand the customers problems,fear,feel anxious worry case not understand customer problem,1
i feel deeply and truly content,joy,feel deeply truly content,2
im feeling rushed and like i should have planned certain things this summer that i can no longer do,anger,m feel rush like plan certain thing summer long,0
i feel nervous about going back to america not knowing what to expect the transition to be like,fear,feel nervous go america know expect transition like,1
i wanted both but i feel greedy,anger,want feel greedy,0
i was beginning to feel fear nevertheless a stubborn person i am i swept the superstition away but i reminded myself to pay extra caution,anger,begin feel fear stubborn person sweep superstition away remind pay extra caution,0
ive found it im feeling pretty pumped,joy,ve find m feel pretty pumped,2
i feel so happily rebellious,anger,feel happily rebellious,0
