Comment,Emotion,processed_comment,labeled_taget
i seriously hate one subject to death but now i feel reluctant to drop it,fear,seriously hate subject death feel reluctant drop,1
im so full of life i feel appalled,anger,m life feel appalled,0
i sit here to write i start to dig out my feelings and i think that i am afraid to accept the possibility that he might not make it,fear,sit write start dig feeling think afraid accept possibility,1
ive been really angry with r and i feel like an idiot for trusting him in the first place,joy,ve angry r feel like idiot trust place,2
i feel suspicious if there is no one outside like the rapture has happened or something,fear,feel suspicious outside like rapture happen,1
i feel jealous becasue i wanted that kind of love the true connection between two souls and i wanted that,anger,feel jealous becasue want kind love true connection soul want,0
when a friend of mine keeps telling me morbid things that happened to his dog,anger,friend keep tell morbid thing happen dog,0
i finally fell asleep feeling angry useless and still full of anxiety,anger,finally fall asleep feel angry useless anxiety,0
i feel a bit annoyed and antsy in a good way,anger,feel bit annoyed antsy good way,0
i feel like i ve regained another vital part of my life which is living,joy,feel like ve regain vital life live,2
i feel a bit like franz liebkind in the producers not many people know it but the fuhrer was a terrific dancer,joy,feel bit like franz liebkind producer people know fuhrer terrific dancer,2
i was feeling at the start didnt want to move much at all was really glad to experience this glimpse into the sort of vibrant energy i will gain through out the year,joy,feel start not want glad experience glimpse sort vibrant energy gain year,2
i was bitten by a dog,fear,bite dog,1
i do not always find myself feeling thankful but over the years i ve gathered a few tricks that allow me to feel grateful in the face of moments when the last thing i want to do is say thanks,joy,find feel thankful year ve gather trick allow feel grateful face moment thing want thank,2
i just try not to talk to anyone when i feel irritable like that,anger,try talk feel irritable like,0
i feel like they hated me since then,anger,feel like hate,0
i dont know who wrote the following little note but this is how i feel today if u r offended by the following posting then you obviously have not lived long enough to be compromised on how you act or believe,anger,not know write following little note feel today u r offend follow post obviously live long compromise act believe,0
i feel offended i choose to tell you guys how i feel because i treated you guys as friends and would want to put a stop to all these nonsense,anger,feel offended choose tell guy feel treat guy friend want stop nonsense,0
i remember feeling as if i didn t belong and that i wasn t smart enough cool enough or even young enough,joy,remember feel didn t belong wasn t smart cool young,2
i feel like i have to redeem myself even though i think they realized why i was distraught and were ok with it,fear,feel like redeem think realize distraught ok,1
i hope that the next quote will be able to let my special someone knows what im feeling insecure about and understand that no matter how much i trust,fear,hope quote able let special know m feel insecure understand matter trust,1
i feel much better and without the help of ice,joy,feel well help ice,2
i am sitting here typing this and wondering where i belong feeling distracted feeling comfortable feeling misunderstood and hurt,anger,sit type wonder belong feel distracted feel comfortable feeling misunderstood hurt,0
i still feel its a little shaky at times and can move into the slightly odd jades hair in particular seems prone to this but generally it works well with spencers writing,fear,feel little shaky time slightly odd jade hair particular prone generally work spencer write,1
i stropped about for a bit feeling grumpy because i was missing out,anger,strop bit feeling grumpy miss,0
i have a feeling i shall go mad,anger,feeling shall mad,0
i am happpy when i get good results in the field of academics or athletics,joy,happpy good result field academic athletic,2
i got the feeling brig is sincere and has a very strong desire to help others become successful both financially and also through building strengthening relationships through christianity,joy,get feeling brig sincere strong desire help successful financially build strengthen relationship christianity,2
im feeling deeply overwhelmed by these ordinary tasks,fear,m feel deeply overwhelmed ordinary task,1
i feel so grouchy and irritable when im sick,anger,feel grouchy irritable m sick,0
i feel my heart shaky all the time now,fear,feel heart shaky time,1
i expect and i feel content with that,joy,expect feel content,2
i feel amused at the absurdity of it all,joy,feel amuse absurdity,2
i end up getting unwanted attention from boys i want little to do with or ill be sort of starting something with a boy then find myself flirtiing with others in his presence or ill feel really insincere around boys that i do like,anger,end get unwanted attention boy want little ill sort start boy find flirtie presence ill feel insincere boy like,0
i just couldnt help feeling a little bit bitter towards his great big happy grin,anger,not help feel little bit bitter great big happy grin,0
i go back to my point about what an easy sell getting folk to feel really virtuous for not doing what they dont want to do anyway,joy,point easy sell get folk feel virtuous not want,2
im feeling a bit more sociable now although i dont think ill be able to express everything i want to say,joy,m feel bit sociable not think ill able express want,2
i would feel joyful,joy,feel joyful,2
at a certain situation i felt myself neglected and undeservedly harmed,anger,certain situation feel neglect undeservedly harm,0
i felt good and feel fine today too,joy,feel good feel fine today,2
i looked at what had happened to us in two generations and looked at what hadn t happened to them in two or three and instead of feeling outraged by their history of aggression i felt privileged by it,anger,look happen generation look hadn t happen instead feel outraged history aggression feel privilege,0
im feeling slightly optimistic,joy,m feel slightly optimistic,2
i feel and some is just a hateful of hollow yes i hear many smiths these days,anger,feel hateful hollow yes hear smith day,0
im still feeling indecisive im polling yall p,fear,m feel indecisive m poll you p,1
sometime back another girl who was in terms with my exboyfriend came to shout at me at twelve midnight it was because she thought i was still interested in the boy,anger,girl term exboyfriend come shout midnight think interested boy,0
id start feeling resentful that i lived in a part of the country where the sun stubbornly refuses to show itself after the end of september,anger,d start feel resentful live country sun stubbornly refuse end september,0
i just feel so fucked up these days,anger,feel fuck day,0
i confess that i was feeling nervous as i made my way to the event venue,fear,confess feel nervous way event venue,1
i was really worried that i would feel intimidated by monica but when we met that morning she was incredibly welcoming and made me feel relaxed straight away,fear,worried feel intimidate monica meet morning incredibly welcoming feel relaxed straight away,1
i was sick with a cold amp not feeling well wondering if i would even be able to have the patience to go to whitleys month photo shoot,joy,sick cold amp feel wonder able patience whitleys month photo shoot,2
i feel like i have been a bit obnoxious in my picture posting,anger,feel like bit obnoxious picture post,0
i feel morally outraged and furious more often than i d like,anger,feel morally outraged furious d like,0
i feel pissed my friend didnt offer me a soda,anger,feel pissed friend not offer soda,0
i feel our hearts are treading dangerous territory,anger,feel heart tread dangerous territory,0
i feel frightened by it all,fear,feel frightened,1
i know it was not pleasant for her and i feel selfish saying it but i think i would have fallen apart if i had been there,anger,know pleasant feel selfish say think fall apart,0
i feel shafted or greedy,anger,feel shafted greedy,0
i have just had such a crappy week that i am still feeling all agitated and like the day wasn t what i wanted,fear,crappy week feel agitated like day wasn t want,1
i feel rebellious because i don t particularly like watching romcoms but i get the feeling that i may be pretty good at writing them,anger,feel rebellious don t particularly like watch romcom feeling pretty good write,0
i feel reluctant to just leave her alone like that without helping her enough to repay her goodness to me,fear,feel reluctant leave like help repay goodness,1
i am ashamed when i feel like that the moment i see terrified crying children and dead ones,fear,ashamed feel like moment terrified cry child dead one,1
i wake up in the morning and have my voice and my throat feels ok but by the afternoon its all scratchy again and i sound like marge simpson until the night when its so bad and my throat is so sore i just have to whisper,joy,wake morning voice throat feel ok afternoon scratchy sound like marge simpson night bad throat sore whisper,2
ive always been very nervous to do something like that as i feel like i am not really that talented to enter something into an official contest,joy,ve nervous like feel like talente enter official contest,2
i feel a bit pissed off because we went first,anger,feel bit pissed go,0
i feel satisfied knowing the dirt and hair is no longer in the car and house,joy,feel satisfied know dirt hair long car house,2
i really like how the special edition really does feel special with songs on it,joy,like special edition feel special song,2
i would accept your gift without feeling mad,anger,accept gift feel mad,0
i feel hesitant to do it since i don t have any experience with programming and all,fear,feel hesitant don t experience programming,1
i was feeling particularly bitchy and i dont think i adequately expressed my appreciation for that,anger,feel particularly bitchy not think adequately express appreciation,0
i do feel confused,fear,feel confused,1
im with you when your professor looks at you like a spitball when your friend is dying when you cry into your pillow at night when you feel the dangerous tickles of jealousy luring you down into its lair,anger,m professor look like spitball friend die cry pillow night feel dangerous tickle jealousy lure lair,0
i didn t feel rushed to finish millions of things and i was able to focus on each task separately,anger,didn t feel rush finish million thing able focus task separately,0
i feel so tortured,anger,feel tortured,0
i dunno how it feels to be completely happy the real world has taught me about struggle but what i m going thru is nothing close to struggle,joy,dunno feel completely happy real world teach struggle m go close struggle,2
i feel like she has taken on the role of a grandmother to me since my beloved grandma is no longer with me,joy,feel like take role grandmother beloved grandma long,2
i fear that other people ask me about my feelings i am most reluctant to talk about things,fear,fear people ask feeling reluctant talk thing,1
i would have smiled except i was starting to feel like any more uptight comments and my jaw would fall right out of my head,fear,smile start feel like uptight comment jaw fall right head,1
i feel so comfortable around him,joy,feel comfortable,2
i feel completely unsure of any boundaries or normalcy,fear,feel completely unsure boundary normalcy,1
i think of or feel gratitude i think of my kind and gracious heavenly father,joy,think feel gratitude think kind gracious heavenly father,2
im feeling really really left out and somewhat dissatisfied with everything,anger,m feel leave somewhat dissatisfied,0
i simply said how sorry i am and just got out from her car and got into my house feeling restless,fear,simply say sorry get car get house feel restless,1
i am feeling weird and feel wanna know,fear,feel weird feel wanna know,1
i had an incredible feeling of frantic despair,fear,incredible feeling frantic despair,1
i feel reluctant to sell but hey,fear,feel reluctant sell hey,1
i take a long sip and feel the cold sensation of the iced capp,anger,long sip feel cold sensation iced capp,0
i wasn t feeling pressured even if this was the longest race and the one i expected the most from,fear,wasn t feeling pressure long race expect,1
i also hope you understand why i feel so angry with you when you dont support the hat rule or when you turn up at a school event sans hat yourself,anger,hope understand feel angry not support hat rule turn school event san hat,0
i remember feeling the most terrified i had ever felt in my entire life and that its still affecting me now but ive never thought it accounted to trauma,fear,remember feel terrified feel entire life affect ve think account trauma,1
i had for me to confess my feelings for her but still i couldnt bring myself to her for i was scared of losing her once more,fear,confess feeling not bring scared lose,1
im clearly influenced by the dash happiness of emily dickinson for example and i use dashes instead of colons or semi colons to enhance the feelings of rushed enjambment in the sonnet,anger,m clearly influence dash happiness emily dickinson example use dash instead colon semi colon enhance feeling rush enjambment sonnet,0
i pray that the eyes that read this the minds that comprehend this and the hearts that feel this will not be offended,anger,pray eye read mind comprehend heart feel offend,0
im not afraid of going on my own but i feel like a lot of people were in groups and a part of me feels like it would be cool to have a small group to hang out with,joy,m afraid go feel like lot people group feel like cool small group hang,2
the possibility of having failed the examination,fear,possibility having fail examination,1
i feel so thankful to be in a part of the country where i can train outdoors this late in the year and not have to bundle up or wear several layers,joy,feel thankful country train outdoors late year bundle wear layer,2
i am feeling rather grouchy too this morning since i didnt sleep last night on purpose,anger,feel grouchy morning not sleep night purpose,0
i feel like the earthquake has also shaken the foundations of my life and work,fear,feel like earthquake shake foundation life work,1
i might be able to recreate the feeling when i get back into the cold fog that awaits me tomorrow night,anger,able recreate feeling cold fog await tomorrow night,0
i woke up feeling positive i was totally in the mood for doing this and this evening i feel the same i had a banana shake for breakfast a chocolate shake for dinner and a sunday roast for tea,joy,wake feel positive totally mood evening feel banana shake breakfast chocolate shake dinner sunday roast tea,2
i would just go to the straight point rather than doing a defination of such as what is romance feeling or anger feeling or suspicious feelings,fear,straight point defination romance feeling anger feeling suspicious feeling,1
i feel so bitchy and mean and terrible,anger,feel bitchy mean terrible,0
i feel envious that they can keep their posts regular and interesting and wish that i could feel this way to,anger,feel envious post regular interesting wish feel way,0
i feel like him try to stay as faithful as possible to what he perceives as the real events that happened in that mountain,joy,feel like try stay faithful possible perceive real event happen mountain,2
i feel assaulted the new kid whined,fear,feel assault new kid whine,1
ive had a long road of that initially feeling like i was being rude for turning down food that was made brought for me and sometimes eating stuff because it was gluten free and looked delicious even if it maybe wasnt what i felt good about eating some really mediocre wedding cake for example,anger,ve long road initially feel like rude turn food bring eat stuff gluten free look delicious maybe not feel good eat mediocre wedding cake example,0
i wanted to make sure i didnt feel rushed getting to century college on friday afternoon,anger,want sure not feel rush get century college friday afternoon,0
id kick myself into gear but i just feel irritable with no motivation what so ever,anger,d kick gear feel irritable motivation,0
i feel so much more productive at college and so to keep that productivity in full gear ill have to chalk up some ideas for art projects this summer train an army of attack pigeons and take over a tiny and uninhabited island,joy,feel productive college productivity gear ill chalk idea art project summer train army attack pigeon tiny uninhabited island,2
i have a feeling that your father already convinced him of that,joy,feeling father convince,2
i feel im not bothered by that,anger,feel m bother,0
i p i could sit here and beat myself up over it all but im feeling far to rebellious for that today basically im feeling angry at the world and at myself all at the same time,anger,p sit beat m feel far rebellious today basically m feel angry world time,0
im totally feeling bitchy and resentful about it,anger,m totally feel bitchy resentful,0
i drove to class i was feeling a little apprehensive but still no sweat,fear,drive class feel little apprehensive sweat,1
i feel so wronged but what can i do,anger,feel wrong,0
i feel so weird that it feels like i wanna curse everything and bang my head onto the wall so that my world will be back to its focus,fear,feel weird feel like wanna curse bang head wall world focus,1
i feel suspicious of wrinkle prevention beauty products for some reason,fear,feel suspicious wrinkle prevention beauty product reason,1
i feel you see frantic and thus i am afraid,fear,feel frantic afraid,1
i am feeling so grumpy today,anger,feel grumpy today,0
i feel that i have gotten to know the students pretty well and i talk to the parents if they drop their students off for the day,joy,feel get know student pretty talk parent drop student day,2
i cant help but feel suspicious of everything,fear,not help feel suspicious,1
i say we because it makes all the difference as a parent when you have an open and easy to talk to teacher who you really feel is the perfect fit for your child,joy,make difference parent open easy talk teacher feel perfect fit child,2
i feel a little bit frightened of islam,fear,feel little bit frightened islam,1
im with her i feel terrific,joy,m feel terrific,2
i feel like this insecurity is a good thing when i first started writing i pictured it all,joy,feel like insecurity good thing start write picture,2
i even had a deep feeling for alaska and the cold and snowy and yet big open land with the pine trees and mountains but im destined to live in southern california,anger,deep feeling alaska cold snowy big open land pine tree mountain m destine live southern california,0
i didn t feel like she was shy so much as taking it all in as her mother has described her,fear,didn t feel like shy take mother describe,1
i feel like any time anyone gets into the ring with him they are so intimidated by his arms and legs they dont even really try,fear,feel like time get ring intimidate arm leg not try,1
im feeling cranky cantankerous and resentful like a house slave basically almost all the mothers i know rely heavily on either alcohol marijuana or separation divorce to get some space and sanity for themselves away from their maternal responsibilities,anger,m feel cranky cantankerous resentful like house slave basically mother know rely heavily alcohol marijuana separation divorce space sanity away maternal responsibility,0
i was going crazy thank god i have a craving for fruits and chocolate it made me go out in the cold with a gross wind blowing in my neck feeling mad and angry and crappy,anger,go crazy thank god craving fruit chocolate cold gross wind blow neck feel mad angry crappy,0
im not convinced that it all makes since because the talking never feels sincere in its execution and maybe the themes in life seem to large to ever fathom but what s the point when it already feels like an emotionless pit of self craving attention,joy,m convinced make talking feel sincere execution maybe theme life large fathom s point feel like emotionless pit self craving attention,2
i had begun to feel apprehensive when thick black rain clouds stormed into the sky above town,fear,begin feel apprehensive thick black rain cloud storm sky town,1
i think that they pop up so automatically because seeing those pictures or people makes me feel insecure about myself,fear,think pop automatically see picture people make feel insecure,1
i shut the door but i didn t feel triumphant,joy,shut door didn t feel triumphant,2
i could even feel his cold breath on my neck whispered hertha as she ran her fingers across the side of neck,anger,feel cold breath neck whisper hertha run finger neck,0
i feel like life gave me a plenty of changes to shine and i pissed all over each and every one of them,anger,feel like life give plenty change shine piss,0
i was feeling grumpy not women problems grumpy but five year old i want to get my way kind of grumpy you don t think there s a difference,anger,feel grumpy woman problem grumpy year old want way kind grumpy don t think s difference,0
i feel like im back in my element and very pleased to be surrounded by adorable tiny garments,joy,feel like m element pleased surround adorable tiny garment,2
i know you feel tortured reading this,anger,know feel tortured read,0
i have a feeling hell be a casual favorite if blue or red are heavy colors at your casual tables otherwise i could see it in tournament decks while red is popular and possibly when if blue steps in its place one zendikar block rotates out,joy,feeling hell casual favorite blue red heavy color casual table tournament deck red popular possibly blue step place zendikar block rotate,2
i think this is a valid complaint for those who arent willing to deal with it this aspect i imagine will be rather subjective but it makes sure that the cover based moments still feel dangerous despite being in cover,anger,think valid complaint not willing deal aspect imagine subjective make sure cover base moment feel dangerous despite cover,0
i feel like it must be a popular choice to have alterations done elsewhere,joy,feel like popular choice alteration,2
i feel bothered,anger,feel bothered,0
i have noticed that if i go with out i start to feel irritated at him or easily annoyed by the things he does i feel this tiny ache inside of me almost unnoticeable the first few days as if a tiny hair had burrowed its way into my foot,anger,notice start feel irritated easily annoy thing feel tiny ache inside unnoticeable day tiny hair burrow way foot,0
i said without emotion while feeling a freaked out fearful anxiety welling up in my chest,fear,say emotion feel freak fearful anxiety well chest,1
i understand that any of my extremely positive attributes and there are some are overshadowed by my weakness and subconsciously some people are wired up to feel superior to others and thereby treat them differently,joy,understand extremely positive attribute overshadow weakness subconsciously people wire feel superior treat differently,2
i find it very hard to feel relaxed for more than hours,joy,find hard feel relaxed hour,2
i am just feeling grumpy and sore,anger,feel grumpy sore,0
i just make assumptions based on what i see think feel i ve wondered this before with strange things,fear,assumption base think feel ve wonder strange thing,1
i feel your motivation will be satisfied when you read this write up also who understands,joy,feel motivation satisfied read write understand,2
i walk in the door to my house i feel happy,joy,walk door house feel happy,2
i feel more terrified than the customers will be in my maze,fear,feel terrified customer maze,1
i found these emails from scott dale and just reading them frusterated me so much that i feel the need to post them and show the world what a neurotic freak he was is,fear,find email scott dale read frusterate feel need post world neurotic freak,1
i have been neglecting the feeling of people around me i was stubborn,anger,neglect feeling people stubborn,0
i have been sneakily listen to x mas music since the beginning of october but now i feel as if it is a little more socially acceptable to prance around while eartha kitt s version of santa baby blares from my ipod,joy,sneakily listen x mas music beginning october feel little socially acceptable prance eartha kitt s version santa baby blare ipod,2
i didn t feel as terrified or as nervous as i normally would in that type of situation,fear,didn t feel terrified nervous normally type situation,1
i typically respond when i feel offended,anger,typically respond feel offended,0
i am wearing and feeling confident about myself,joy,wear feel confident,2
i feel like i am as fearful now as i was when i first threw my leg over the top tube after my surgery,fear,feel like fearful throw leg tube surgery,1
i feel unprotected if i do though,fear,feel unprotected,1
im feeling artistic today,joy,m feel artistic today,2
i confess to feeling a bit nervous now though there are some very talented people in the group,fear,confess feel bit nervous talented people group,1
i managed to eat more than i usually can on race morning mostly because jon was there and i didnt feel quite as nervous,fear,manage eat usually race morning jon not feel nervous,1
i had never read the posts i never would have spent the emotional and mental energy to argue with them in my head or feel irritated by them,anger,read post spend emotional mental energy argue head feel irritated,0
